A dinner invitation…,Gifts you’d like to receive…,Thanks for everything…
A place you’d like to visit…,I heard some gossip…,The art of napping…
A word of advice…,Monastery mysteries…,The existence of Crests…
Books you’ve read recently…,Our first meeting…,The library’s collection…
Capable comrades…,Overcoming weaknesses…,The view from the bridge…
Cats…,Past laughs…,Things that bother you…
Exploring the monastery…,Plans for the future…,Working hours for guards…
Favorite sweets…,Strange fish in the pond…,–
Gardening mishaps…,Tell me about yourself…,–
